{
  "registry_version": "autonomous_flow_registry.v1",
  "generated_from": [
    "docs/contracts/autonomous-flow-trial/TRIAL_B_GLOBAL_PROTOCOL_CN.md",
    "docs/contracts/autonomous-flow-trial/TRIAL_C_LEDGER_AND_PUBLISH_DECISION_CN.md",
    "docs/contracts/autonomous-flow-trial/TRIAL_C_REGISTRY_AND_CLAIM_GATE_DECISION_CN.md"
  ],
  "events": [
    {
      "id": "phase5.cycle.started.v1",
      "status": "registered",
      "provider": "phase5_scheduler_or_main_process",
      "consumers": ["operations_workbench", "cycle_ledger", "reviewer"],
      "min_payload_fields": ["cycle_id", "trigger", "scope", "input_contract_versions", "started_at"],
      "maturity": "partial"
    },
    {
      "id": "phase5.artifact.produced.v1",
      "status": "registered",
      "provider": "phase5_runner",
      "consumers": ["projection_builder", "reviewer", "cycle_ledger"],
      "min_payload_fields": ["cycle_id", "artifact_id", "artifact_family", "schema_version", "as_of_date", "lineage_ref"],
      "maturity": "partial"
    },
    {
      "id": "phase5.gate.evaluated.v1",
      "status": "registered",
      "provider": "gate_evaluator",
      "consumers": ["scheduler", "frontend_projection", "reviewer"],
      "min_payload_fields": ["cycle_id", "gate_id", "gate_status", "claim_ceiling", "next_action", "blocking_reasons"],
      "maturity": "partial"
    },
    {
      "id": "phase5.projection.refreshed.v1",
      "status": "registered",
      "provider": "projection_builder",
      "consumers": ["publish_verifier", "api_spa", "operations_workbench"],
      "min_payload_fields": ["cycle_id", "projection_id", "projection_family", "source_artifact_ids", "freshness_at", "staleness_status"],
      "maturity": "partial"
    },
    {
      "id": "phase5.recovery.recorded.v1",
      "status": "registered",
      "provider": "recovery_runner_or_main_process",
      "consumers": ["scheduler", "reviewer", "trial_report"],
      "min_payload_fields": ["cycle_id", "ticket_id", "failed_step", "failure_class", "recovery_action", "final_status"],
      "maturity": "partial"
    },
    {
      "id": "phase5.scheduler.diagnostic.recorded.v1",
      "status": "registered",
      "provider": "phase5_scheduler",
      "consumers": ["scheduler", "reviewer", "operations"],
      "min_payload_fields": [
        "diagnostic_id",
        "cycle_id",
        "severity",
        "scheduler_action",
        "failure_class",
        "recommended_recovery_action",
        "blocking_reasons",
        "evidence_refs",
        "observed_at"
      ],
      "maturity": "partial"
    },
    {
      "id": "phase5.scheduler.execution.recorded.v1",
      "status": "registered",
      "provider": "phase5_scheduler",
      "consumers": ["scheduler", "reviewer", "operations"],
      "min_payload_fields": [
        "execution_id",
        "idempotency_key",
        "cycle_id",
        "plan_action",
        "execution_status",
        "would_execute",
        "diagnostic_refs",
        "blocking_reasons",
        "created_at"
      ],
      "maturity": "partial"
    },
    {
      "id": "phase5.scheduler.attempt_run.recorded.v1",
      "status": "registered",
      "provider": "phase5_scheduler",
      "consumers": ["scheduler", "reviewer", "operations"],
      "min_payload_fields": [
        "run_id",
        "attempt_id",
        "cycle_id",
        "runner_id",
        "issued_at",
        "attempt_status",
        "route_type",
        "preflight_status",
        "apply_status",
        "applied_output",
        "required_arguments",
        "missing_arguments",
        "cycle_event_recorded",
        "error_type"
      ],
      "maturity": "partial"
    },
    {
      "id": "phase5.scheduler.attempt_intervention_run.recorded.v1",
      "status": "registered",
      "provider": "phase5_scheduler",
      "consumers": ["scheduler", "reviewer", "operations"],
      "min_payload_fields": [
        "intervention_run_id",
        "cycle_id",
        "runner_id",
        "issued_at",
        "execution_status",
        "applied_output",
        "action",
        "required_arguments",
        "missing_arguments",
        "source_latest_run_id"
      ],
      "maturity": "partial"
    },
    {
      "id": "phase5.scheduler.auto_progress_run.recorded.v1",
      "status": "registered",
      "provider": "phase5_scheduler",
      "consumers": ["scheduler", "reviewer", "operations_workbench"],
      "min_payload_fields": [
        "auto_progress_run_id",
        "cycle_id",
        "runner_id",
        "issued_at",
        "plan_status",
        "phase",
        "apply_status",
        "applied_output",
        "recommended_output",
        "result_refs"
      ],
      "maturity": "partial"
    },
    {
      "id": "artifact.validation_manifest.created.v1",
      "status": "registered",
      "provider": "validation_runner",
      "consumers": ["recommendation_projection", "phase5_gate", "research_review"],
      "min_payload_fields": ["artifact_id", "experiment_version", "split_plan_id", "universe_definition", "generated_at"],
      "maturity": "usable"
    },
    {
      "id": "artifact.validation_metrics.created.v1",
      "status": "registered",
      "provider": "validation_runner",
      "consumers": ["historical_validation", "claim_gate", "frontend_projection"],
      "min_payload_fields": ["artifact_id", "manifest_id", "status", "sample_count", "coverage_ratio", "metrics_ref"],
      "maturity": "usable"
    },
    {
      "id": "artifact.portfolio_backtest.created.v1",
      "status": "registered",
      "provider": "portfolio_research_runner",
      "consumers": ["simulation_policy_gate", "operations_workbench"],
      "min_payload_fields": ["artifact_id", "manifest_id", "strategy_definition", "cost_definition", "gate_readout_ref"],
      "maturity": "partial"
    },
    {
      "id": "artifact.holding_policy_study.created.v1",
      "status": "registered",
      "provider": "phase5_policy_runner",
      "consumers": ["policy_governance", "operations_workbench"],
      "min_payload_fields": ["artifact_id", "policy_type", "gate_status", "governance_action", "redesign_focus_areas"],
      "maturity": "partial"
    },
    {
      "id": "recommendation.projected.v1",
      "status": "registered",
      "provider": "recommendation_projection",
      "consumers": ["frontend", "manual_llm_context_pack"],
      "min_payload_fields": ["recommendation_key", "core_quant", "evidence", "risk", "historical_validation", "claim_ceiling"],
      "maturity": "usable"
    },
    {
      "id": "manual_llm_review.requested.v1",
      "status": "registered",
      "provider": "frontend_or_user_action",
      "consumers": ["manual_review_worker"],
      "min_payload_fields": ["request_id", "target_login", "symbol", "context_packet_id", "requested_at"],
      "maturity": "usable"
    },
    {
      "id": "manual_llm_review.completed.v1",
      "status": "registered",
      "provider": "manual_review_worker",
      "consumers": ["recommendation_projection", "frontend"],
      "min_payload_fields": ["request_id", "model_label", "summary", "risks", "disagreements", "source_packet_ref"],
      "maturity": "usable"
    },
    {
      "id": "shortpick.run.completed.v1",
      "status": "registered",
      "provider": "shortpick_lab_runner",
      "consumers": ["validation_queue", "topic_classifier", "feedback_projection"],
      "min_payload_fields": ["run_id", "signal_available_at", "provider_set", "candidate_count", "source_packet_ref"],
      "maturity": "partial"
    },
    {
      "id": "shortpick.validation_snapshot.created.v1",
      "status": "registered",
      "provider": "shortpick_validation_worker",
      "consumers": ["model_feedback", "history_replay", "frontend"],
      "min_payload_fields": ["snapshot_id", "run_id", "symbol", "validation_mode", "tradeability_status", "benchmark_map"],
      "maturity": "partial"
    },
    {
      "id": "frontend.projection.updated.v1",
      "status": "registered",
      "provider": "projection_builder",
      "consumers": ["api_spa"],
      "min_payload_fields": ["projection_name", "version", "generated_at", "source_artifact_ids", "staleness_status"],
      "maturity": "partial"
    },
    {
      "id": "runtime.publish.verified.v1",
      "status": "registered",
      "provider": "main_process_closeout",
      "consumers": ["project_status", "process_log", "phase5_cycle_ledger"],
      "min_payload_fields": ["commit_id", "release_manifest", "localhost_result", "canonical_result"],
      "maturity": "usable"
    }
  ],
  "artifact_families": [
    {
      "id": "phase5_cycle_ledger",
      "status": "registered",
      "schema_ref": "schemas/phase5_cycle_ledger.schema.json",
      "provider": "main_autonomous_process_or_scheduler",
      "consumers": ["operations", "reviewer", "next_cycle_planner"],
      "maturity": "partial"
    },
    {
      "id": "phase5_recovery_ticket",
      "status": "registered",
      "schema_ref": "schemas/phase5_recovery_ticket.schema.json",
      "provider": "recovery_runner",
      "consumers": ["scheduler", "reviewer", "trial_report"],
      "maturity": "partial"
    },
    {
      "id": "phase5_scheduler_diagnostic",
      "status": "registered",
      "schema_ref": "schemas/phase5_scheduler_diagnostic.schema.json",
      "provider": "phase5_scheduler",
      "consumers": ["scheduler", "reviewer", "operations"],
      "maturity": "partial"
    },
    {
      "id": "phase5_scheduler_execution_ledger",
      "status": "registered",
      "schema_ref": "schemas/phase5_scheduler_execution_ledger.schema.json",
      "provider": "phase5_scheduler",
      "consumers": ["scheduler", "reviewer", "operations"],
      "maturity": "partial"
    },
    {
      "id": "phase5_scheduler_execution_reservation",
      "status": "registered",
      "schema_ref": "schemas/phase5_scheduler_execution_reservation.schema.json",
      "provider": "phase5_scheduler",
      "consumers": ["scheduler", "reviewer", "operations"],